{
  "schema_version": "1.0",
  "experiment_id": "trustworthy_inference_v1",
  "experiment_type": "INFERENCE_ABLATION",
  "status": "PLANNED",
  "created_at": "2026-09-04T00:00:00Z",
  "checkpoint_sha256": "sha256:0000000000000000000000000000000000000000000000000000000000000000",
  "benchmark_manifest_sha256": "sha256:0000000000000000000000000000000000000000000000000000000000000000",
  "seeds": [
    42,
    137,
    2026
  ],
  "variants": [
    {
      "variant_id": "unresolved_b1",
      "changed_factor": "CONSTANT_RESOLUTION",
      "factor_value": false,
      "candidate_cache_id": "raw_candidates_k16",
      "active_rollout_budget": 0,
      "replay_budget": 0,
      "protocol_overrides": {
        "candidate_budget": 1,
        "constant_resolution": false
      }
    },
    {
      "variant_id": "resolved_b1",
      "changed_factor": "CONSTANT_RESOLUTION",
      "factor_value": true,
      "candidate_cache_id": "raw_candidates_k16",
      "active_rollout_budget": 0,
      "replay_budget": 0,
      "protocol_overrides": {
        "candidate_budget": 1,
        "constant_resolution": true
      }
    },
    {
      "variant_id": "resolved_b8",
      "changed_factor": "CANDIDATE_BUDGET",
      "factor_value": 8,
      "candidate_cache_id": "raw_candidates_k16",
      "active_rollout_budget": 0,
      "replay_budget": 0,
      "protocol_overrides": {
        "candidate_budget": 8,
        "constant_resolution": true
      }
    },
    {
      "variant_id": "resolved_b16",
      "changed_factor": "CANDIDATE_BUDGET",
      "factor_value": 16,
      "candidate_cache_id": "raw_candidates_k16",
      "active_rollout_budget": 0,
      "replay_budget": 0,
      "protocol_overrides": {
        "candidate_budget": 16,
        "constant_resolution": true
      }
    }
  ],
  "invariants": {
    "observed_horizon": 20,
    "unseen_horizon": 100,
    "fuel_per_invocation": 10000,
    "memory_limit_mib": 16,
    "mdl_ratio_max": 1.2
  },
  "decision_schedule": [],
  "max_trial_hours": 2.0,
  "max_total_hours": 12.0,
  "outcomes": []
}