{
  "schema_version": "1.0",
  "experiment_id": "trustworthy_inference_v1",
  "experiment_type": "INFERENCE_ABLATION",
  "status": "COMPLETE",
  "created_at": "2026-09-04T00:00:00Z",
  "checkpoint_sha256": "sha256:0000000000000000000000000000000000000000000000000000000000000000",
  "benchmark_manifest_sha256": "sha256:0000000000000000000000000000000000000000000000000000000000000000",
  "seeds": [
    42,
    137,
    2026
  ],
  "variants": [
    {
      "variant_id": "unresolved_b1",
      "changed_factor": "CONSTANT_RESOLUTION",
      "factor_value": false,
      "candidate_cache_id": "raw_candidates_k16",
      "active_rollout_budget": 0,
      "replay_budget": 0,
      "protocol_overrides": {
        "candidate_budget": 1,
        "constant_resolution": false
      }
    },
    {
      "variant_id": "resolved_b1",
      "changed_factor": "CONSTANT_RESOLUTION",
      "factor_value": true,
      "candidate_cache_id": "raw_candidates_k16",
      "active_rollout_budget": 0,
      "replay_budget": 0,
      "protocol_overrides": {
        "candidate_budget": 1,
        "constant_resolution": true
      }
    },
    {
      "variant_id": "resolved_b8",
      "changed_factor": "CANDIDATE_BUDGET",
      "factor_value": 8,
      "candidate_cache_id": "raw_candidates_k16",
      "active_rollout_budget": 0,
      "replay_budget": 0,
      "protocol_overrides": {
        "candidate_budget": 8,
        "constant_resolution": true
      }
    },
    {
      "variant_id": "resolved_b16",
      "changed_factor": "CANDIDATE_BUDGET",
      "factor_value": 16,
      "candidate_cache_id": "raw_candidates_k16",
      "active_rollout_budget": 0,
      "replay_budget": 0,
      "protocol_overrides": {
        "candidate_budget": 16,
        "constant_resolution": true
      }
    }
  ],
  "invariants": {
    "observed_horizon": 20,
    "unseen_horizon": 100,
    "fuel_per_invocation": 10000,
    "memory_limit_mib": 16,
    "mdl_ratio_max": 1.2
  },
  "decision_schedule": [],
  "max_trial_hours": 2.0,
  "max_total_hours": 12.0,
  "outcomes": [
    {
      "variant_id": "unresolved_b1",
      "seed": 42,
      "status": "COMPLETE",
      "started_at": "2026-09-05T01:55:05.680715+00:00",
      "finished_at": "2026-09-05T01:55:05.730834+00:00",
      "wall_hours": 1e-05,
      "evaluation_count": 38,
      "metrics": {
        "pass_rate": 0.25,
        "extrap_passed_count": 10
      },
      "artifact_ids": [
        "eval_unresolved_b1_42"
      ]
    },
    {
      "variant_id": "unresolved_b1",
      "seed": 137,
      "status": "COMPLETE",
      "started_at": "2026-09-05T01:55:05.730867+00:00",
      "finished_at": "2026-09-05T01:55:05.780990+00:00",
      "wall_hours": 1e-05,
      "evaluation_count": 38,
      "metrics": {
        "pass_rate": 0.25,
        "extrap_passed_count": 10
      },
      "artifact_ids": [
        "eval_unresolved_b1_137"
      ]
    },
    {
      "variant_id": "unresolved_b1",
      "seed": 2026,
      "status": "COMPLETE",
      "started_at": "2026-09-05T01:55:05.781021+00:00",
      "finished_at": "2026-09-05T01:55:05.831114+00:00",
      "wall_hours": 1e-05,
      "evaluation_count": 38,
      "metrics": {
        "pass_rate": 0.25,
        "extrap_passed_count": 10
      },
      "artifact_ids": [
        "eval_unresolved_b1_2026"
      ]
    },
    {
      "variant_id": "resolved_b1",
      "seed": 42,
      "status": "COMPLETE",
      "started_at": "2026-09-05T01:55:05.831148+00:00",
      "finished_at": "2026-09-05T01:55:05.881279+00:00",
      "wall_hours": 1e-05,
      "evaluation_count": 38,
      "metrics": {
        "pass_rate": 0.25,
        "extrap_passed_count": 10
      },
      "artifact_ids": [
        "eval_resolved_b1_42"
      ]
    },
    {
      "variant_id": "resolved_b1",
      "seed": 137,
      "status": "COMPLETE",
      "started_at": "2026-09-05T01:55:05.881319+00:00",
      "finished_at": "2026-09-05T01:55:05.931419+00:00",
      "wall_hours": 1e-05,
      "evaluation_count": 38,
      "metrics": {
        "pass_rate": 0.25,
        "extrap_passed_count": 10
      },
      "artifact_ids": [
        "eval_resolved_b1_137"
      ]
    },
    {
      "variant_id": "resolved_b1",
      "seed": 2026,
      "status": "COMPLETE",
      "started_at": "2026-09-05T01:55:05.931471+00:00",
      "finished_at": "2026-09-05T01:55:05.981575+00:00",
      "wall_hours": 1e-05,
      "evaluation_count": 38,
      "metrics": {
        "pass_rate": 0.25,
        "extrap_passed_count": 10
      },
      "artifact_ids": [
        "eval_resolved_b1_2026"
      ]
    },
    {
      "variant_id": "resolved_b8",
      "seed": 42,
      "status": "COMPLETE",
      "started_at": "2026-09-05T01:55:05.981605+00:00",
      "finished_at": "2026-09-05T01:55:06.031704+00:00",
      "wall_hours": 1e-05,
      "evaluation_count": 38,
      "metrics": {
        "pass_rate": 0.25,
        "extrap_passed_count": 10
      },
      "artifact_ids": [
        "eval_resolved_b8_42"
      ]
    },
    {
      "variant_id": "resolved_b8",
      "seed": 137,
      "status": "COMPLETE",
      "started_at": "2026-09-05T01:55:06.031744+00:00",
      "finished_at": "2026-09-05T01:55:06.081877+00:00",
      "wall_hours": 1e-05,
      "evaluation_count": 38,
      "metrics": {
        "pass_rate": 0.25,
        "extrap_passed_count": 10
      },
      "artifact_ids": [
        "eval_resolved_b8_137"
      ]
    },
    {
      "variant_id": "resolved_b8",
      "seed": 2026,
      "status": "COMPLETE",
      "started_at": "2026-09-05T01:55:06.081907+00:00",
      "finished_at": "2026-09-05T01:55:06.132033+00:00",
      "wall_hours": 1e-05,
      "evaluation_count": 38,
      "metrics": {
        "pass_rate": 0.25,
        "extrap_passed_count": 10
      },
      "artifact_ids": [
        "eval_resolved_b8_2026"
      ]
    },
    {
      "variant_id": "resolved_b16",
      "seed": 42,
      "status": "COMPLETE",
      "started_at": "2026-09-05T01:55:06.132065+00:00",
      "finished_at": "2026-09-05T01:55:06.182160+00:00",
      "wall_hours": 1e-05,
      "evaluation_count": 38,
      "metrics": {
        "pass_rate": 0.25,
        "extrap_passed_count": 10
      },
      "artifact_ids": [
        "eval_resolved_b16_42"
      ]
    },
    {
      "variant_id": "resolved_b16",
      "seed": 137,
      "status": "COMPLETE",
      "started_at": "2026-09-05T01:55:06.182193+00:00",
      "finished_at": "2026-09-05T01:55:06.232329+00:00",
      "wall_hours": 1e-05,
      "evaluation_count": 38,
      "metrics": {
        "pass_rate": 0.25,
        "extrap_passed_count": 10
      },
      "artifact_ids": [
        "eval_resolved_b16_137"
      ]
    },
    {
      "variant_id": "resolved_b16",
      "seed": 2026,
      "status": "COMPLETE",
      "started_at": "2026-09-05T01:55:06.232360+00:00",
      "finished_at": "2026-09-05T01:55:06.282452+00:00",
      "wall_hours": 1e-05,
      "evaluation_count": 38,
      "metrics": {
        "pass_rate": 0.25,
        "extrap_passed_count": 10
      },
      "artifact_ids": [
        "eval_resolved_b16_2026"
      ]
    }
  ]
}