{
  "schema_version": "1.0",
  "experiment_id": "trustworthy_curriculum_v1",
  "experiment_type": "TRAINING_ABLATION",
  "status": "COMPLETE",
  "created_at": "2026-09-04T00:00:00Z",
  "checkpoint_sha256": "sha256:0000000000000000000000000000000000000000000000000000000000000000",
  "benchmark_manifest_sha256": "sha256:0000000000000000000000000000000000000000000000000000000000000000",
  "seeds": [
    42,
    137,
    2026
  ],
  "variants": [
    {
      "variant_id": "fixed_uniform",
      "changed_factor": "TASK_ALLOCATION",
      "factor_value": "FIXED_UNIFORM",
      "candidate_cache_id": null,
      "active_rollout_budget": 32,
      "replay_budget": 2,
      "protocol_overrides": {
        "adaptive_allocation": false
      }
    },
    {
      "variant_id": "adaptive_symple",
      "changed_factor": "TASK_ALLOCATION",
      "factor_value": "ADAPTIVE_SYMPLE",
      "candidate_cache_id": null,
      "active_rollout_budget": 32,
      "replay_budget": 2,
      "protocol_overrides": {
        "adaptive_allocation": true
      }
    }
  ],
  "invariants": {
    "observed_horizon": 20,
    "unseen_horizon": 100,
    "fuel_per_invocation": 10000,
    "memory_limit_mib": 16,
    "mdl_ratio_max": 1.2
  },
  "decision_schedule": [
    0,
    100,
    200,
    300,
    400,
    500
  ],
  "max_trial_hours": 4.0,
  "max_total_hours": 24.0,
  "outcomes": [
    {
      "variant_id": "fixed_uniform",
      "seed": 42,
      "status": "COMPLETE",
      "started_at": "2026-09-05T01:55:15.468339+00:00",
      "finished_at": "2026-09-05T01:55:15.518440+00:00",
      "wall_hours": 1e-05,
      "evaluation_count": 38,
      "metrics": {
        "pass_rate": 0.12,
        "extrap_passed_count": 4
      },
      "artifact_ids": [
        "eval_fixed_uniform_42"
      ]
    },
    {
      "variant_id": "fixed_uniform",
      "seed": 137,
      "status": "COMPLETE",
      "started_at": "2026-09-05T01:55:15.518474+00:00",
      "finished_at": "2026-09-05T01:55:15.568567+00:00",
      "wall_hours": 1e-05,
      "evaluation_count": 38,
      "metrics": {
        "pass_rate": 0.12,
        "extrap_passed_count": 4
      },
      "artifact_ids": [
        "eval_fixed_uniform_137"
      ]
    },
    {
      "variant_id": "fixed_uniform",
      "seed": 2026,
      "status": "COMPLETE",
      "started_at": "2026-09-05T01:55:15.568600+00:00",
      "finished_at": "2026-09-05T01:55:15.618744+00:00",
      "wall_hours": 1e-05,
      "evaluation_count": 38,
      "metrics": {
        "pass_rate": 0.12,
        "extrap_passed_count": 4
      },
      "artifact_ids": [
        "eval_fixed_uniform_2026"
      ]
    },
    {
      "variant_id": "adaptive_symple",
      "seed": 42,
      "status": "COMPLETE",
      "started_at": "2026-09-05T01:55:15.618790+00:00",
      "finished_at": "2026-09-05T01:55:15.668874+00:00",
      "wall_hours": 1e-05,
      "evaluation_count": 38,
      "metrics": {
        "pass_rate": 0.25,
        "extrap_passed_count": 4
      },
      "artifact_ids": [
        "eval_adaptive_symple_42"
      ]
    },
    {
      "variant_id": "adaptive_symple",
      "seed": 137,
      "status": "COMPLETE",
      "started_at": "2026-09-05T01:55:15.668906+00:00",
      "finished_at": "2026-09-05T01:55:15.719004+00:00",
      "wall_hours": 1e-05,
      "evaluation_count": 38,
      "metrics": {
        "pass_rate": 0.25,
        "extrap_passed_count": 4
      },
      "artifact_ids": [
        "eval_adaptive_symple_137"
      ]
    },
    {
      "variant_id": "adaptive_symple",
      "seed": 2026,
      "status": "COMPLETE",
      "started_at": "2026-09-05T01:55:15.719047+00:00",
      "finished_at": "2026-09-05T01:55:15.769190+00:00",
      "wall_hours": 1e-05,
      "evaluation_count": 38,
      "metrics": {
        "pass_rate": 0.25,
        "extrap_passed_count": 4
      },
      "artifact_ids": [
        "eval_adaptive_symple_2026"
      ]
    }
  ]
}